{
  "schema_version": "proto_self.v2",
  "event_id": "telegram:dm:8420019401_cmd_2188",
  "timestamp": "2026-03-29T12:22:42.911861",
  "event": {
    "actor": "user",
    "source": "telegram",
    "event_type": "user_message",
    "user_intent": "/new",
    "raw_text": "/new"
  },
  "conversation_summary": {
    "session_id": "telegram:dm:8420019401",
    "thread_id": "telegram:dm:8420019401",
    "turn_id": "cmd_2188"
  },
  "task_summary": {
    "pending_tasks": 0,
    "blocked_tasks": 0
  },
  "runtime_summary": {
    "runtime": "runtime_v2",
    "state_scope": "agent_global",
    "restore_observation": null
  },
  "safety_context": {
    "risk_level": "low"
  },
  "executed_action_prev": null,
  "external_outcome": null,
  "intervention_context": {},
  "prediction_snapshot_prev": {}
}